{
  "apiVersion": "pmcro.dev/v1",
  "kind": "skill.create.request",
  "requestId": "req-example-001",
  "trailId": "trail-example",
  "cycleId": "cycle-example",
  "sourceIntent": "Create a bounded console-output skill.",
  "plugin": "pmcro",
  "skill": "dotnet-console-output",
  "description": "Render checked PMCR-O output for a .NET console projection.",
  "purpose": "Provide a reusable, documented console output adapter.",
  "scope": "project",
  "validatedResources": ["pmcro-output-conventions", "pmcro-agent-surface"],
  "requiredFolders": ["agents", "scripts", "references", "assets", "tests"],
  "requiredFiles": ["SKILL.md", "agents/openai.yaml", "scripts/validate.ps1", "references/sample-prompts.md", "assets/README.md", "tests/README.md"],
  "samplePromptsRef": "references/sample-prompts.md",
  "messageContract": {"input": ["intent"], "output": ["SkillOutput"], "accept": ["checker passes"], "deny": ["unscoped authority"]},
  "mode": "simulate"
}
